{
  "schema_version": "1.4",
  "id": "framework-lab",
  "version": "0.4.0",
  "project": "AI-Native Engineering Framework Lab",
  "actions": [
    {
      "kind": "reason_context",
      "capabilities": ["context_reasoning"],
      "effects": ["READ_ONLY"],
      "actor": "AI",
      "deterministic": false,
      "authority_required": false,
      "preferred_surfaces": ["general-chat"],
      "human_handoff": {
        "goal": "Evaluate the resolved engineering context and determine the applicable conclusion.",
        "observation": "Observe the supplied context, target, constraints, and verification requirement.",
        "decision": "Determine whether the available context supports the requested engineering conclusion.",
        "expected_interpretation": "A supported conclusion is bounded by the supplied context and canonical authority."
      }
    },
    {
      "kind": "inspect_repository",
      "capabilities": ["repository_inspection"],
      "effects": ["READ_ONLY"],
      "actor": "AI",
      "deterministic": false,
      "authority_required": false,
      "preferred_surfaces": ["work-mode"],
      "human_handoff": {
        "goal": "Inspect the resolved repository target and determine its actual implementation state.",
        "observation": "Observe repository files, revision state, configuration, and requested verification evidence.",
        "decision": "Determine whether the repository state satisfies the specified inspection requirement.",
        "expected_interpretation": "A conforming result is supported by repository evidence at the resolved target."
      }
    },
    {
      "kind": "edit_document",
      "capabilities": ["document_edit"],
      "effects": ["ARTIFACT_WRITE"],
      "actor": "AI",
      "deterministic": false,
      "authority_required": true,
      "preferred_surfaces": ["work-mode"],
      "human_handoff": {
        "goal": "Edit the resolved document target within the approved content and authority boundary.",
        "observation": "Observe the source document, required changes, preserved structure, and rendered result.",
        "decision": "Determine whether the edited document implements the approved change without scope drift.",
        "expected_interpretation": "A conforming document preserves required structure and contains only approved changes."
      }
    },
    {
      "kind": "mutate_repository",
      "capabilities": ["repository_mutation"],
      "effects": ["REPOSITORY_MUTATION"],
      "actor": "AI",
      "deterministic": true,
      "authority_required": true,
      "preferred_surfaces": ["codex"],
      "human_handoff": {
        "goal": "Apply the approved repository mutation to the resolved target and verify the resulting state.",
        "observation": "Observe changed files, repository diff, scope boundaries, and verification results.",
        "decision": "Determine whether the repository mutation is complete, verified, and within authority.",
        "expected_interpretation": "A successful result contains only approved changes and passes required verification."
      }
    },
    {
      "kind": "git_branch",
      "capabilities": ["git_operation"],
      "effects": ["REPOSITORY_MUTATION"],
      "actor": "AI",
      "deterministic": true,
      "authority_required": true,
      "preferred_surfaces": ["codex"],
      "human_handoff": {
        "goal": "Perform the approved Git operation against the resolved repository and branch target.",
        "observation": "Observe branch identity, revision history, working tree state, and remote relationship.",
        "decision": "Determine whether the Git state matches the approved synchronization responsibility.",
        "expected_interpretation": "A successful Git result preserves unrelated work and matches the approved boundary."
      }
    },
    {
      "kind": "run_command",
      "capabilities": ["command_execution"],
      "effects": ["COMMAND_EXECUTION"],
      "actor": "AI",
      "deterministic": true,
      "authority_required": true,
      "preferred_surfaces": ["codex"],
      "human_handoff": {
        "goal": "Execute the approved command against the resolved target and determine whether it completed safely.",
        "observation": "Observe command output, exit status, target state, and the specified verification evidence.",
        "decision": "Determine whether command execution satisfied the verification requirement without boundary violation.",
        "expected_interpretation": "A successful command result satisfies verification and preserves the approved execution boundary."
      }
    },
    {
      "kind": "run_tests",
      "capabilities": ["command_execution"],
      "effects": ["COMMAND_EXECUTION"],
      "actor": "AI",
      "deterministic": true,
      "authority_required": true,
      "preferred_surfaces": ["codex"],
      "human_handoff": {
        "goal": "Run the approved verification suite against the resolved target and assess the result.",
        "observation": "Observe test selection, command output, failure counts, errors, and build status.",
        "decision": "Determine whether the applicable automated verification completed without unacceptable failure.",
        "expected_interpretation": "A passing result establishes automated conformance only for the verified implementation scope."
      }
    },
    {
      "kind": "observe_runtime",
      "capabilities": ["runtime_observation"],
      "effects": ["RUNTIME_OBSERVATION"],
      "actor": "HUMAN",
      "deterministic": false,
      "authority_required": true,
      "preferred_surfaces": ["human-terminal"],
      "human_handoff": {
        "goal": "Observe the resolved runtime target and determine whether the required operational condition holds.",
        "observation": "Observe target health, runtime signals, recorded evidence, and the verification requirement.",
        "decision": "Determine whether the observed runtime state satisfies the approved operational criterion.",
        "expected_interpretation": "A satisfied criterion establishes only the runtime condition identified by the verification evidence."
      }
    },
    {
      "kind": "mutate_runtime",
      "capabilities": ["runtime_mutation"],
      "effects": ["RUNTIME_MUTATION"],
      "actor": "HUMAN",
      "deterministic": true,
      "authority_required": true,
      "preferred_surfaces": ["human-terminal"],
      "human_handoff": {
        "goal": "Apply the approved runtime change to the resolved target and determine its resulting state.",
        "observation": "Observe the target before and after mutation, side effects, and required safety evidence.",
        "decision": "Determine whether the runtime mutation completed within the approved risk and authority boundary.",
        "expected_interpretation": "A successful mutation reaches the approved target state without prohibited side effects."
      }
    }
  ],
  "trusted_human_responsibilities": [
    {
      "id": "framework-lab:human-authority",
      "human_necessity_basis": "HUMAN_AUTHORITY_REQUIRED",
      "return_responsibility_kinds": ["DECISION_OR_APPROVAL"],
      "action_kinds": ["edit_document", "mutate_repository", "git_branch", "run_command", "run_tests", "observe_runtime", "mutate_runtime"],
      "human_role": "AUTHORITY_DECISION",
      "required_session_role": "Human Approval Authority",
      "required_request_owners": [
        {"request_field": "decision_owner", "required_owner": "Project human owner"}
      ]
    },
    {
      "id": "framework-lab:direct-observation",
      "human_necessity_basis": "DIRECT_HUMAN_OBSERVATION_OBJECTIVE",
      "return_responsibility_kinds": ["DIRECT_OBSERVATION"],
      "action_kinds": ["reason_context", "inspect_repository", "run_command", "run_tests", "observe_runtime"],
      "human_role": "DIRECT_OBSERVER",
      "required_session_role": "Human Direct Observer",
      "required_request_owners": [
        {"request_field": "verification_owner", "required_owner": "Project human reviewer"}
      ]
    },
    {
      "id": "framework-lab:risk-control",
      "human_necessity_basis": "HUMAN_RISK_CONTROL_REQUIRED",
      "return_responsibility_kinds": ["RISK_CONTROL_DECISION", "BLAST_RADIUS_CONTROL"],
      "action_kinds": ["edit_document", "mutate_repository", "git_branch", "run_command", "run_tests", "observe_runtime", "mutate_runtime"],
      "human_role": "RISK_CONTROL",
      "required_session_role": "Human Risk Controller",
      "required_request_owners": [
        {"request_field": "decision_owner", "required_owner": "Project human owner"}
      ]
    },
    {
      "id": "framework-lab:learning",
      "human_necessity_basis": "HUMAN_LEARNING_OBJECTIVE",
      "return_responsibility_kinds": ["LEARNING_OUTCOME"],
      "action_kinds": ["reason_context", "inspect_repository", "edit_document", "mutate_repository", "git_branch", "run_command", "run_tests", "observe_runtime", "mutate_runtime"],
      "human_role": "LEARNER",
      "required_session_role": "Human Learning Investigator",
      "required_request_owners": [
        {"request_field": "decision_owner", "required_owner": "Project human owner"}
      ]
    },
    {
      "id": "framework-lab:direct-engineering",
      "human_necessity_basis": "HUMAN_EXECUTION_SIMPLER_OR_SAFER",
      "return_responsibility_kinds": ["DIRECT_ENGINEERING_RESULT"],
      "action_kinds": ["inspect_repository", "edit_document", "mutate_repository", "git_branch", "run_command", "run_tests", "observe_runtime", "mutate_runtime"],
      "human_role": "DIRECT_ENGINEER",
      "required_session_role": "Human Direct Engineering Owner",
      "required_request_owners": [
        {"request_field": "decision_owner", "required_owner": "Project human owner"},
        {"request_field": "verification_owner", "required_owner": "Project human reviewer"}
      ]
    },
    {
      "id": "framework-lab:no-ai-surface",
      "human_necessity_basis": "NO_SUITABLE_AUTHORIZED_AI_SURFACE",